{
  "assumptions": {
    "anchor_dimension_sd_logit": 0.1,
    "anchor_rater_sd_logit": 0.3,
    "anchor_true_preference": 0.9,
    "assignment_plan": "standard_target_six_raters",
    "brief_sd_logit": 0.35,
    "continuity_pass_probability": 1.0,
    "dimension_sd_logit": 0.15,
    "mixed_repeat_runs_per_condition": 5,
    "rater_sd_logit": 0.3,
    "reliability_mode": "simulate",
    "run_sd_logit": 0.15,
    "tie_rate": 0.15
  },
  "protocol_hash": "sha256:732a776eedbbc6fd8ef0f068c9ed45816563731804f0b2e9f47d150e7de8077c",
  "review": {
    "rationale": "Illustrative package fixture only; replace assumptions with calibration-observed values, keep reliability_mode=simulate, and record a human review before freeze.",
    "reviewed_at": null,
    "reviewed_by": null,
    "status": "example"
  },
  "rule_source_hash": "sha256:0ea13eda2ef10a415342f3488b84f46e78ea85f0ba53c62693490e6df6f3e63f",
  "run_mode": "standard_six",
  "scenarios": [
    {
      "anchor_rater_sd_logit": 0.3,
      "anchor_true_preference": 0.9,
      "brief_sd_logit": 0.35,
      "name": "calibration_central",
      "points": [
        {
          "eventual_pass_probability": 0.0143,
          "instrument_pass_probability": 0.9367,
          "mixed_repeat_conditional_pass_probability": 0.0411,
          "mixed_repeat_conditional_trials": 851,
          "mixed_repeat_runs_per_condition": 5,
          "primary_decision_probabilities": {
            "FAIL": 0.7185,
            "INCONCLUSIVE": 0.0633,
            "MIXED": 0.2127,
            "PASS": 0.0055
          },
          "reliability_diagnostic_means": {
            "causal_progression": {
              "krippendorff_alpha_nominal": 0.0132,
              "raw_pairwise_agreement": 0.3981,
              "tie_rate": 0.1499
            },
            "character_voice": {
              "krippendorff_alpha_nominal": 0.0127,
              "raw_pairwise_agreement": 0.3975,
              "tie_rate": 0.15
            },
            "specificity": {
              "krippendorff_alpha_nominal": 0.0135,
              "raw_pairwise_agreement": 0.399,
              "tie_rate": 0.1492
            }
          },
          "true_preference": 0.5
        },
        {
          "eventual_pass_probability": 0.05,
          "instrument_pass_probability": 0.939,
          "mixed_repeat_conditional_pass_probability": 0.082,
          "mixed_repeat_conditional_trials": 1500,
          "mixed_repeat_runs_per_condition": 5,
          "primary_decision_probabilities": {
            "FAIL": 0.5447,
            "INCONCLUSIVE": 0.061,
            "MIXED": 0.375,
            "PASS": 0.0192
          },
          "reliability_diagnostic_means": {
            "causal_progression": {
              "krippendorff_alpha_nominal": 0.013,
              "raw_pairwise_agreement": 0.4005,
              "tie_rate": 0.1507
            },
            "character_voice": {
              "krippendorff_alpha_nominal": 0.0115,
              "raw_pairwise_agreement": 0.4,
              "tie_rate": 0.1504
            },
            "specificity": {
              "krippendorff_alpha_nominal": 0.0123,
              "raw_pairwise_agreement": 0.4013,
              "tie_rate": 0.1489
            }
          },
          "true_preference": 0.55
        },
        {
          "eventual_pass_probability": 0.3543,
          "instrument_pass_probability": 0.9325,
          "mixed_repeat_conditional_pass_probability": 0.2856,
          "mixed_repeat_conditional_trials": 2325,
          "mixed_repeat_runs_per_condition": 5,
          "primary_decision_probabilities": {
            "FAIL": 0.163,
            "INCONCLUSIVE": 0.0675,
            "MIXED": 0.5813,
            "PASS": 0.1883
          },
          "reliability_diagnostic_means": {
            "causal_progression": {
              "krippendorff_alpha_nominal": 0.0104,
              "raw_pairwise_agreement": 0.4242,
              "tie_rate": 0.1508
            },
            "character_voice": {
              "krippendorff_alpha_nominal": 0.0151,
              "raw_pairwise_agreement": 0.4285,
              "tie_rate": 0.1498
            },
            "specificity": {
              "krippendorff_alpha_nominal": 0.0104,
              "raw_pairwise_agreement": 0.4241,
              "tie_rate": 0.1507
            }
          },
          "true_preference": 0.65
        },
        {
          "eventual_pass_probability": 0.5902,
          "instrument_pass_probability": 0.9305,
          "mixed_repeat_conditional_pass_probability": 0.4631,
          "mixed_repeat_conditional_trials": 2084,
          "mixed_repeat_runs_per_condition": 5,
          "primary_decision_probabilities": {
            "FAIL": 0.0605,
            "INCONCLUSIVE": 0.0695,
            "MIXED": 0.521,
            "PASS": 0.349
          },
          "reliability_diagnostic_means": {
            "causal_progression": {
              "krippendorff_alpha_nominal": 0.0047,
              "raw_pairwise_agreement": 0.4419,
              "tie_rate": 0.1505
            },
            "character_voice": {
              "krippendorff_alpha_nominal": 0.0097,
              "raw_pairwise_agreement": 0.4465,
              "tie_rate": 0.1501
            },
            "specificity": {
              "krippendorff_alpha_nominal": 0.0091,
              "raw_pairwise_agreement": 0.4451,
              "tie_rate": 0.1505
            }
          },
          "true_preference": 0.7
        },
        {
          "eventual_pass_probability": 0.7915,
          "instrument_pass_probability": 0.9333,
          "mixed_repeat_conditional_pass_probability": 0.6154,
          "mixed_repeat_conditional_trials": 1326,
          "mixed_repeat_runs_per_condition": 5,
          "primary_decision_probabilities": {
            "FAIL": 0.0143,
            "INCONCLUSIVE": 0.0668,
            "MIXED": 0.3315,
            "PASS": 0.5875
          },
          "reliability_diagnostic_means": {
            "causal_progression": {
              "krippendorff_alpha_nominal": 0.0058,
              "raw_pairwise_agreement": 0.4735,
              "tie_rate": 0.1494
            },
            "character_voice": {
              "krippendorff_alpha_nominal": 0.0064,
              "raw_pairwise_agreement": 0.4731,
              "tie_rate": 0.1503
            },
            "specificity": {
              "krippendorff_alpha_nominal": 0.0086,
              "raw_pairwise_agreement": 0.4741,
              "tie_rate": 0.1503
            }
          },
          "true_preference": 0.75
        },
        {
          "eventual_pass_probability": 0.9345,
          "instrument_pass_probability": 0.9365,
          "mixed_repeat_conditional_pass_probability": 0.9424,
          "mixed_repeat_conditional_trials": 139,
          "mixed_repeat_runs_per_condition": 5,
          "primary_decision_probabilities": {
            "FAIL": 0.0,
            "INCONCLUSIVE": 0.0635,
            "MIXED": 0.0348,
            "PASS": 0.9018
          },
          "reliability_diagnostic_means": {
            "causal_progression": {
              "krippendorff_alpha_nominal": 0.0032,
              "raw_pairwise_agreement": 0.5548,
              "tie_rate": 0.1503
            },
            "character_voice": {
              "krippendorff_alpha_nominal": 0.0069,
              "raw_pairwise_agreement": 0.5544,
              "tie_rate": 0.15
            },
            "specificity": {
              "krippendorff_alpha_nominal": 0.0029,
              "raw_pairwise_agreement": 0.5536,
              "tie_rate": 0.1491
            }
          },
          "true_preference": 0.85
        }
      ],
      "rater_sd_logit": 0.3,
      "tie_rate": 0.15
    },
    {
      "anchor_rater_sd_logit": 0.18,
      "anchor_true_preference": 0.93,
      "brief_sd_logit": 0.21,
      "name": "lower_heterogeneity",
      "points": [
        {
          "eventual_pass_probability": 0.0035,
          "instrument_pass_probability": 0.977,
          "mixed_repeat_conditional_pass_probability": 0.0146,
          "mixed_repeat_conditional_trials": 756,
          "mixed_repeat_runs_per_condition": 5,
          "primary_decision_probabilities": {
            "FAIL": 0.7873,
            "INCONCLUSIVE": 0.023,
            "MIXED": 0.189,
            "PASS": 0.0008
          },
          "reliability_diagnostic_means": {
            "causal_progression": {
              "krippendorff_alpha_nominal": 0.0104,
              "raw_pairwise_agreement": 0.4253,
              "tie_rate": 0.0996
            },
            "character_voice": {
              "krippendorff_alpha_nominal": 0.0068,
              "raw_pairwise_agreement": 0.4231,
              "tie_rate": 0.1001
            },
            "specificity": {
              "krippendorff_alpha_nominal": 0.01,
              "raw_pairwise_agreement": 0.4245,
              "tie_rate": 0.1001
            }
          },
          "true_preference": 0.5
        },
        {
          "eventual_pass_probability": 0.0325,
          "instrument_pass_probability": 0.9792,
          "mixed_repeat_conditional_pass_probability": 0.0558,
          "mixed_repeat_conditional_trials": 1596,
          "mixed_repeat_runs_per_condition": 5,
          "primary_decision_probabilities": {
            "FAIL": 0.57,
            "INCONCLUSIVE": 0.0208,
            "MIXED": 0.399,
            "PASS": 0.0103
          },
          "reliability_diagnostic_means": {
            "causal_progression": {
              "krippendorff_alpha_nominal": 0.0084,
              "raw_pairwise_agreement": 0.4281,
              "tie_rate": 0.0997
            },
            "character_voice": {
              "krippendorff_alpha_nominal": 0.0078,
              "raw_pairwise_agreement": 0.4278,
              "tie_rate": 0.0996
            },
            "specificity": {
              "krippendorff_alpha_nominal": 0.0106,
              "raw_pairwise_agreement": 0.4289,
              "tie_rate": 0.0999
            }
          },